{
  "title": "ValueFlowResult",
  "$schema": "https://json-schema.org/draft/2020-12/schema",
  "type": "object",
  "properties": {
    "outcome": {
      "type": "string",
      "enum": [
        "ok",
        "assumed",
        "partial",
        "not-analyzed",
        "unsupported",
        "stale",
        "cancelled",
        "budget"
      ]
    },
    "generation": {
      "type": "integer",
      "exclusiveMinimum": 0,
      "maximum": 9007199254740991
    },
    "programHash": {
      "type": "string"
    },
    "tsconfig": {
      "type": "string"
    },
    "typescript": {
      "type": "string"
    },
    "reason": {
      "type": [
        "string",
        "null"
      ]
    },
    "selection": {
      "type": "object",
      "properties": {
        "file": {
          "type": "string"
        },
        "span": {
          "type": "object",
          "properties": {
            "startLine": {
              "type": "integer",
              "exclusiveMinimum": 0,
              "maximum": 9007199254740991
            },
            "startColumn": {
              "type": "integer",
              "exclusiveMinimum": 0,
              "maximum": 9007199254740991
            },
            "endLine": {
              "type": "integer",
              "exclusiveMinimum": 0,
              "maximum": 9007199254740991
            },
            "endColumn": {
              "type": "integer",
              "exclusiveMinimum": 0,
              "maximum": 9007199254740991
            }
          },
          "required": [
            "startLine",
            "startColumn",
            "endLine",
            "endColumn"
          ],
          "additionalProperties": false
        },
        "text": {
          "type": "string"
        },
        "kind": {
          "type": "string"
        }
      },
      "required": [
        "file",
        "span",
        "text",
        "kind"
      ],
      "additionalProperties": false
    },
    "rows": {
      "type": "array",
      "items": {
        "type": "object",
        "properties": {
          "id": {
            "type": "string"
          },
          "kind": {
            "type": "string",
            "enum": [
              "input",
              "transfer",
              "fallback",
              "branch",
              "transform",
              "terminal",
              "boundary"
            ]
          },
          "label": {
            "type": "string"
          },
          "file": {
            "type": "string"
          },
          "absPath": {
            "type": "string"
          },
          "line": {
            "type": "integer",
            "exclusiveMinimum": 0,
            "maximum": 9007199254740991
          },
          "span": {
            "type": "object",
            "properties": {
              "startLine": {
                "type": "integer",
                "exclusiveMinimum": 0,
                "maximum": 9007199254740991
              },
              "startColumn": {
                "type": "integer",
                "exclusiveMinimum": 0,
                "maximum": 9007199254740991
              },
              "endLine": {
                "type": "integer",
                "exclusiveMinimum": 0,
                "maximum": 9007199254740991
              },
              "endColumn": {
                "type": "integer",
                "exclusiveMinimum": 0,
                "maximum": 9007199254740991
              }
            },
            "required": [
              "startLine",
              "startColumn",
              "endLine",
              "endColumn"
            ],
            "additionalProperties": false
          },
          "status": {
            "type": "string",
            "enum": [
              "proven",
              "partial",
              "unsupported"
            ]
          },
          "elementId": {
            "type": [
              "string",
              "null"
            ]
          },
          "relationId": {
            "type": [
              "string",
              "null"
            ]
          },
          "proof": {
            "type": "array",
            "items": {
              "type": "object",
              "properties": {
                "kind": {
                  "type": "string",
                  "minLength": 1
                },
                "detail": {
                  "type": "string",
                  "minLength": 1
                },
                "locations": {
                  "minItems": 1,
                  "type": "array",
                  "items": {
                    "type": "object",
                    "properties": {
                      "file": {
                        "type": "string",
                        "minLength": 1
                      },
                      "line": {
                        "type": "integer",
                        "exclusiveMinimum": 0,
                        "maximum": 9007199254740991
                      },
                      "column": {
                        "type": "integer",
                        "exclusiveMinimum": 0,
                        "maximum": 9007199254740991
                      },
                      "span": {
                        "type": "object",
                        "properties": {
                          "startLine": {
                            "type": "integer",
                            "exclusiveMinimum": 0,
                            "maximum": 9007199254740991
                          },
                          "startColumn": {
                            "type": "integer",
                            "exclusiveMinimum": 0,
                            "maximum": 9007199254740991
                          },
                          "endLine": {
                            "type": "integer",
                            "exclusiveMinimum": 0,
                            "maximum": 9007199254740991
                          },
                          "endColumn": {
                            "type": "integer",
                            "exclusiveMinimum": 0,
                            "maximum": 9007199254740991
                          }
                        },
                        "required": [
                          "startLine",
                          "startColumn",
                          "endLine",
                          "endColumn"
                        ],
                        "additionalProperties": false
                      }
                    },
                    "required": [
                      "file",
                      "line",
                      "column",
                      "span"
                    ],
                    "additionalProperties": false
                  }
                },
                "status": {
                  "type": "string",
                  "enum": [
                    "proven",
                    "partial",
                    "unsupported"
                  ]
                }
              },
              "required": [
                "kind",
                "detail",
                "locations",
                "status"
              ],
              "additionalProperties": false
            }
          },
          "typeText": {
            "type": [
              "string",
              "null"
            ]
          },
          "note": {
            "type": [
              "string",
              "null"
            ]
          },
          "reason": {
            "type": [
              "string",
              "null"
            ]
          }
        },
        "required": [
          "id",
          "kind",
          "label",
          "file",
          "absPath",
          "line",
          "span",
          "status",
          "elementId",
          "relationId",
          "proof",
          "typeText",
          "note",
          "reason"
        ],
        "additionalProperties": false
      }
    },
    "frontiers": {
      "type": "array",
      "items": {
        "type": "object",
        "properties": {
          "rowId": {
            "type": "string"
          },
          "reason": {
            "type": "string"
          },
          "label": {
            "type": "string"
          }
        },
        "required": [
          "rowId",
          "reason",
          "label"
        ],
        "additionalProperties": false
      }
    },
    "terminals": {
      "type": "array",
      "items": {
        "type": "string"
      }
    },
    "coverage": {
      "type": "object",
      "properties": {
        "elements": {
          "type": "integer",
          "minimum": 0,
          "maximum": 9007199254740991
        },
        "relations": {
          "type": "integer",
          "minimum": 0,
          "maximum": 9007199254740991
        },
        "budget": {
          "type": "object",
          "properties": {
            "limit": {
              "type": "integer",
              "minimum": 0,
              "maximum": 9007199254740991
            },
            "used": {
              "type": "integer",
              "minimum": 0,
              "maximum": 9007199254740991
            },
            "exhausted": {
              "type": "boolean"
            }
          },
          "required": [
            "limit",
            "used",
            "exhausted"
          ],
          "additionalProperties": false
        }
      },
      "required": [
        "elements",
        "relations",
        "budget"
      ],
      "additionalProperties": false
    },
    "bindings": {
      "type": "object",
      "properties": {
        "tsconfig": {
          "type": "string"
        },
        "typescript": {
          "type": "string"
        },
        "sourceFingerprints": {
          "type": "array",
          "items": {
            "type": "object",
            "properties": {
              "file": {
                "type": "string"
              },
              "size": {
                "type": "integer",
                "minimum": 0,
                "maximum": 9007199254740991
              },
              "mtimeMs": {
                "type": "number"
              }
            },
            "required": [
              "file",
              "size",
              "mtimeMs"
            ],
            "additionalProperties": false
          }
        }
      },
      "required": [
        "tsconfig",
        "typescript",
        "sourceFingerprints"
      ],
      "additionalProperties": false
    }
  },
  "required": [
    "outcome",
    "generation",
    "programHash",
    "tsconfig",
    "typescript",
    "reason",
    "selection",
    "rows",
    "frontiers",
    "terminals",
    "coverage",
    "bindings"
  ],
  "additionalProperties": false
}
