{
  "bindings": {
    "sourceFingerprints": [
      {
        "file": "src/f.tsx",
        "mtimeMs": 1,
        "size": 1
      }
    ],
    "tsconfig": "/fixture/tsconfig.json",
    "typescript": "5.9.3"
  },
  "coverage": {
    "budget": {
      "exhausted": false,
      "limit": 256,
      "used": 1
    },
    "elements": 2,
    "relations": 1
  },
  "frontiers": [
    {
      "label": "shout(\u2026)",
      "reason": "unproven-handoff",
      "rowId": "row:2"
    }
  ],
  "generation": 1,
  "outcome": "partial",
  "programHash": "hash-1",
  "reason": null,
  "rows": [
    {
      "absPath": "/fixture/src/f.tsx",
      "elementId": "el:1",
      "file": "src/f.tsx",
      "id": "row:1",
      "kind": "input",
      "label": "props.item.title",
      "line": 1,
      "note": null,
      "proof": [],
      "reason": null,
      "relationId": null,
      "span": {
        "endColumn": 58,
        "endLine": 1,
        "startColumn": 42,
        "startLine": 1
      },
      "status": "proven",
      "typeText": "string"
    },
    {
      "absPath": "/fixture/src/f.tsx",
      "elementId": "el:1",
      "file": "src/f.tsx",
      "id": "row:2",
      "kind": "boundary",
      "label": "shout(\u2026)",
      "line": 1,
      "note": "shout has 2 call sites (src/f.tsx:3, src/f.tsx:4)",
      "proof": [],
      "reason": "unproven-handoff",
      "relationId": null,
      "span": {
        "endColumn": 58,
        "endLine": 1,
        "startColumn": 42,
        "startLine": 1
      },
      "status": "partial",
      "typeText": "string"
    }
  ],
  "selection": {
    "file": "src/f.tsx",
    "kind": "PropertyAccessExpression",
    "span": {
      "endColumn": 58,
      "endLine": 1,
      "startColumn": 42,
      "startLine": 1
    },
    "text": "props.item.title"
  },
  "terminals": [],
  "tsconfig": "/fixture/tsconfig.json",
  "typescript": "5.9.3"
}
